{
  "scenario": "repo-shape",
  "generated_at": "2026-03-31",
  "results": [
    {
      "scenario": "repo-shape",
      "variant": "monolith",
      "wall_time_ms": 768,
      "peak_rss_kb": null,
      "thread_count_max": null,
      "throughput": null,
      "latency_p50_ms": null,
      "latency_p95_ms": null,
      "context_files": 11,
      "context_bytes": 4928,
      "selected_tests": 3,
      "selected_arcs": 1,
      "notes": [
        "Changed paths: src/orders.rs",
        "Stop condition: stop after local compile, tests, and doctests"
      ]
    },
    {
      "scenario": "repo-shape",
      "variant": "arcified",
      "wall_time_ms": 709,
      "peak_rss_kb": null,
      "thread_count_max": null,
      "throughput": null,
      "latency_p50_ms": null,
      "latency_p95_ms": null,
      "context_files": 2,
      "context_bytes": 1094,
      "selected_tests": 3,
      "selected_arcs": 1,
      "notes": [
        "Changed paths: crates/orders-core/src/lib.rs",
        "Stop condition: stop after local compile, tests, and doctests"
      ]
    }
  ],
  "cases": [],
  "notes": [
    "Both fixtures implement the same order-quoting flow, but one lives in a monolith and one is split into ARCs.",
    "The changed path models a local business-rule change rather than a public API break."
  ]
}